{
    "$schema": "interactions.schema.json",
    "rules": [
        {
            "hgss_reaction": 472,
            "status": "poison",
            "chance": 100,
            "steps": [
                {
                    "motion": 3,
                    "message": 27,
                    "cry": "slow_cry",
                    "bubble": 6,
                    "wait": 0
                }
            ]
        },
        {
            "hgss_reaction": 400,
            "status": "burn",
            "chance": 90,
            "steps": [
                {
                    "motion": 3,
                    "message": 23,
                    "cry": "slow_cry",
                    "bubble": 3,
                    "wait": 0
                }
            ]
        },
        {
            "hgss_reaction": 307,
            "status": "freeze",
            "chance": 90,
            "steps": [
                {
                    "motion": 3,
                    "message": 20,
                    "cry": "slow_cry",
                    "bubble": 4,
                    "wait": 0
                }
            ]
        },
        {
            "hgss_reaction": 222,
            "status": "any_status",
            "chance": 100,
            "steps": [
                {
                    "motion": 3,
                    "message": 16,
                    "cry": "slow_cry",
                    "bubble": 3,
                    "wait": 0
                }
            ]
        },
        {
            "hgss_reaction": 436,
            "hp": "1_to_24_percent",
            "chance": 90,
            "steps": [
                {
                    "motion": 4,
                    "message": 25,
                    "cry": "slow_cry",
                    "bubble": 3,
                    "wait": 0
                }
            ]
        },
        {
            "hgss_reaction": 363,
            "hp": "25_to_49_percent",
            "chance": 60,
            "steps": [
                {
                    "motion": 3,
                    "message": 21,
                    "cry": "none",
                    "bubble": 3,
                    "wait": 0
                }
            ]
        },
        {
            "hgss_reaction": 93,
            "friendship": "90_or_more",
            "chance": 20,
            "steps": [
                {
                    "motion": 2,
                    "message": 0,
                    "cry": "cry",
                    "bubble": 0,
                    "wait": 0
                },
                {
                    "motion": 2,
                    "message": 7,
                    "cry": "none",
                    "bubble": 2,
                    "wait": 0
                }
            ]
        },
        {
            "hgss_reaction": 92,
            "friendship": "90_or_more",
            "chance": 20,
            "steps": [
                {
                    "motion": 2,
                    "message": 6,
                    "cry": "cry",
                    "bubble": 2,
                    "wait": 0
                }
            ]
        },
        {
            "hgss_reaction": 84,
            "friendship": "90_or_more",
            "chance": 30,
            "steps": [
                {
                    "motion": 2,
                    "message": 0,
                    "cry": "none",
                    "bubble": 0,
                    "wait": 0
                },
                {
                    "motion": 2,
                    "message": 2,
                    "cry": "cry",
                    "bubble": 5,
                    "wait": 0
                }
            ]
        },
        {
            "hgss_reaction": 88,
            "friendship": "255",
            "facing": "left",
            "chance": 30,
            "steps": [
                {
                    "motion": 9,
                    "message": 5,
                    "cry": "cry",
                    "bubble": 2,
                    "wait": 0
                }
            ]
        },
        {
            "hgss_reaction": 89,
            "friendship": "255",
            "facing": "right",
            "chance": 30,
            "steps": [
                {
                    "motion": 10,
                    "message": 5,
                    "cry": "cry",
                    "bubble": 2,
                    "wait": 0
                }
            ]
        },
        {
            "hgss_reaction": 90,
            "friendship": "255",
            "facing": "up",
            "chance": 30,
            "steps": [
                {
                    "motion": 11,
                    "message": 5,
                    "cry": "cry",
                    "bubble": 2,
                    "wait": 0
                }
            ]
        },
        {
            "hgss_reaction": 91,
            "friendship": "255",
            "facing": "down",
            "chance": 30,
            "steps": [
                {
                    "motion": 12,
                    "message": 5,
                    "cry": "cry",
                    "bubble": 2,
                    "wait": 0
                }
            ]
        },
        {
            "hgss_reaction": 85,
            "friendship": "255",
            "chance": 30,
            "steps": [
                {
                    "motion": 2,
                    "message": 3,
                    "cry": "cry",
                    "bubble": 1,
                    "wait": 0
                }
            ]
        },
        {
            "hgss_reaction": 103,
            "friendship": "200_to_254",
            "chance": 30,
            "steps": [
                {
                    "motion": 1,
                    "message": 0,
                    "cry": "none",
                    "bubble": 7,
                    "wait": 0
                },
                {
                    "motion": 1,
                    "message": 12,
                    "cry": "none",
                    "bubble": 2,
                    "wait": 0
                }
            ]
        },
        {
            "hgss_reaction": 97,
            "friendship": "200_to_254",
            "chance": 30,
            "steps": [
                {
                    "motion": 2,
                    "message": 9,
                    "cry": "none",
                    "bubble": 2,
                    "wait": 0
                }
            ]
        },
        {
            "hgss_reaction": 99,
            "friendship": "150_to_199",
            "chance": 30,
            "steps": [
                {
                    "motion": 2,
                    "message": 0,
                    "cry": "cry",
                    "bubble": 0,
                    "wait": 0
                },
                {
                    "motion": 2,
                    "message": 10,
                    "cry": "none",
                    "bubble": 5,
                    "wait": 0
                }
            ]
        },
        {
            "hgss_reaction": 100,
            "friendship": "150_to_199",
            "chance": 30,
            "steps": [
                {
                    "motion": 2,
                    "message": 11,
                    "cry": "cry",
                    "bubble": 2,
                    "wait": 0
                }
            ]
        },
        {
            "hgss_reaction": 83,
            "friendship": "90_to_149",
            "chance": 30,
            "steps": [
                {
                    "motion": 2,
                    "message": 0,
                    "cry": "none",
                    "bubble": 0,
                    "wait": 0
                },
                {
                    "motion": 2,
                    "message": 1,
                    "cry": "cry",
                    "bubble": 5,
                    "wait": 0
                }
            ]
        },
        {
            "hgss_reaction": 441,
            "friendship": "90_to_149",
            "facing": "left",
            "chance": 30,
            "steps": [
                {
                    "motion": 2,
                    "message": 0,
                    "cry": "cry",
                    "bubble": 0,
                    "wait": 0
                },
                {
                    "motion": 2,
                    "message": 26,
                    "cry": "none",
                    "bubble": 2,
                    "wait": 0
                }
            ]
        },
        {
            "hgss_reaction": 185,
            "friendship": "90_to_149",
            "facing": "right",
            "chance": 30,
            "steps": [
                {
                    "motion": 1,
                    "message": 0,
                    "cry": "cry",
                    "bubble": 2,
                    "wait": 0
                },
                {
                    "motion": 6,
                    "message": 14,
                    "cry": "none",
                    "bubble": 5,
                    "wait": 0
                }
            ]
        },
        {
            "hgss_reaction": 186,
            "friendship": "90_to_149",
            "facing": "up",
            "chance": 30,
            "steps": [
                {
                    "motion": 1,
                    "message": 0,
                    "cry": "cry",
                    "bubble": 2,
                    "wait": 0
                },
                {
                    "motion": 7,
                    "message": 14,
                    "cry": "none",
                    "bubble": 5,
                    "wait": 0
                }
            ]
        },
        {
            "hgss_reaction": 187,
            "friendship": "90_to_149",
            "facing": "down",
            "chance": 20,
            "steps": [
                {
                    "motion": 1,
                    "message": 0,